<?xml version="1.0" encoding="UTF-8" standalone="no"?>
<!-- LUIS DAVID DIAZ MESA
SERGIO MONTALBÁN ATENCIA-->
<!--   <!DOCTYPE mensaje SYSTEM "mensaje.dtd"> -->
<mensaje 
    xmlns:xsi="http://www.w3.org/2001/XMLSchema-instance"
    xsi:noNamespaceSchemaLocation="mensaje.xsd">
    <email respuesta="no">
        <cabecera>
            <emisor>Luis David </emisor>
            <receptor>Manuel Quesada</receptor>
            <fecha>6 Octubre</fecha>
        </cabecera>
        <asunto></asunto>
        <texto>
            <saludo></saludo>
        </texto>
    </email>
</mensaje>
